{
  "project_id": "k230-sdk",
  "platform": "canaan_k230",
  "target": "platforms/canaan_k230/target.json",
  "hardware_inputs": {
    "trm": [],
    "schematic": [
      "/root/.codex/attachments/ee58dcb1-6c23-4627-82d5-3b2445243485/SCH_CanMV-K230-LP4-V3.0_20240509_2024-07-15(1).pdf"
    ],
    "svd": [],
    "dts": [],
    "cmsis_pack": [],
    "platformio": []
  },
  "features": ["boot", "rtos", "micropython", "camera", "display", "npu_runtime"],
  "firmware": {
    "backend": "canmv-editable",
    "source": "third_party/canmv-v1.8-editable",
    "build_script": "third_party/canmv-v1.8-editable/repro/build-editable.sh",
    "artifact": "third_party/canmv-v1.8-editable/output/k230_canmv_v3p0_defconfig/CanMV_K230_V3P0_micropython_local_nncase_v2.11.0.img",
    "source_lock": "products/sysuos_k230_v3p0/manifest.lock.xml",
    "overlay": "products/sysuos_k230_v3p0/overlay",
    "product": "products/sysuos_k230_v3p0/product.json",
    "install_main": false
  },
  "models": [],
  "runtime": "rt-smart",
  "image_media": "sd",
  "lab_config": null,
  "required_evidence_level": "E2",
  "allowed_claims": []
}
